[
  {
    "id": "chm210-01-what-is-reaction-rate",
    "title": "What Reaction Rate Means",
    "description": "Defining reaction rate as change in concentration over time and how it is measured experimentally.",
    "type": "conceptual",
    "course_id": "chm210-gombe",
    "module": "Foundations",
    "week": 1,
    "mastery_criteria": "Student can express a reaction rate in terms of reactant loss or product gain and state its units.",
    "video_id": "PLACEHOLDER",
    "video_duration_seconds": 240
  },
  {
    "id": "chm210-02-collision-theory",
    "title": "Collision Theory",
    "description": "Why reactions require collisions of sufficient energy and correct orientation to occur.",
    "type": "conceptual",
    "course_id": "chm210-gombe",
    "module": "Foundations",
    "week": 1,
    "mastery_criteria": "Student can explain the two collision requirements and relate collision frequency to rate.",
    "video_id": "PLACEHOLDER",
    "video_duration_seconds": 255
  },
  {
    "id": "chm210-03-measuring-concentration",
    "title": "Measuring Concentration Over Time",
    "description": "Experimental techniques for tracking how reactant and product concentrations change.",
    "type": "procedural",
    "course_id": "chm210-gombe",
    "module": "Foundations",
    "week": 2,
    "mastery_criteria": "Student can describe at least two methods for following a reaction's progress and read a concentration-time curve.",
    "video_id": "PLACEHOLDER",
    "video_duration_seconds": 230
  },
  {
    "id": "chm210-04-rate-law-form",
    "title": "The Form of a Rate Law",
    "description": "How a rate law relates rate to reactant concentrations through a rate constant and orders.",
    "type": "conceptual",
    "course_id": "chm210-gombe",
    "module": "Rate Laws",
    "week": 2,
    "mastery_criteria": "Student can write a general rate law and identify the rate constant and reaction orders.",
    "video_id": "PLACEHOLDER",
    "video_duration_seconds": 265
  },
  {
    "id": "chm210-05-reaction-order",
    "title": "Reaction Order & Its Meaning",
    "description": "What zero-, first- and second-order dependence tells you about how concentration affects rate.",
    "type": "conceptual",
    "course_id": "chm210-gombe",
    "module": "Rate Laws",
    "week": 3,
    "mastery_criteria": "Student can interpret the order with respect to a reactant and the overall reaction order.",
    "video_id": "PLACEHOLDER",
    "video_duration_seconds": 250
  },
  {
    "id": "chm210-06-method-of-initial-rates",
    "title": "Finding Order by Initial Rates",
    "description": "Using the initial-rates method to determine reaction orders from experimental data.",
    "type": "procedural",
    "course_id": "chm210-gombe",
    "module": "Rate Laws",
    "week": 3,
    "mastery_criteria": "Student can determine reaction orders and the rate constant from a table of initial-rate experiments.",
    "video_id": "PLACEHOLDER",
    "video_duration_seconds": 300
  },
  {
    "id": "chm210-07-integrated-first-order",
    "title": "Integrated First-Order Rate Law",
    "description": "Deriving and using the integrated first-order law, including the linear ln[A] plot.",
    "type": "procedural",
    "course_id": "chm210-gombe",
    "module": "Integrated Rate Laws",
    "week": 4,
    "mastery_criteria": "Student can use the integrated first-order equation and recognise its straight-line plot.",
    "video_id": "PLACEHOLDER",
    "video_duration_seconds": 290
  },
  {
    "id": "chm210-08-integrated-second-order",
    "title": "Integrated Second-Order Rate Law",
    "description": "The integrated second-order law and how its 1/[A] plot distinguishes it from first order.",
    "type": "procedural",
    "course_id": "chm210-gombe",
    "module": "Integrated Rate Laws",
    "week": 4,
    "mastery_criteria": "Student can apply the integrated second-order equation and identify order from linearised plots.",
    "video_id": "PLACEHOLDER",
    "video_duration_seconds": 285
  },
  {
    "id": "chm210-09-half-life",
    "title": "Half-Life & Reaction Order",
    "description": "How half-life depends on concentration differently for each reaction order.",
    "type": "conceptual",
    "course_id": "chm210-gombe",
    "module": "Integrated Rate Laws",
    "week": 5,
    "mastery_criteria": "Student can compute half-life for first-order reactions and explain how it differs by order.",
    "video_id": "PLACEHOLDER",
    "video_duration_seconds": 245
  },
  {
    "id": "chm210-10-activation-energy",
    "title": "Activation Energy & the Energy Barrier",
    "description": "The energy barrier a reaction must cross and how it relates to the transition state.",
    "type": "conceptual",
    "course_id": "chm210-gombe",
    "module": "Temperature & Catalysis",
    "week": 5,
    "mastery_criteria": "Student can define activation energy and sketch a reaction energy profile with a transition state.",
    "video_id": "PLACEHOLDER",
    "video_duration_seconds": 260
  },
  {
    "id": "chm210-11-arrhenius-equation",
    "title": "The Arrhenius Equation",
    "description": "How the rate constant depends on temperature and activation energy through the Arrhenius relation.",
    "type": "procedural",
    "course_id": "chm210-gombe",
    "module": "Temperature & Catalysis",
    "week": 6,
    "mastery_criteria": "Student can use the Arrhenius equation to find activation energy from rate constants at two temperatures.",
    "video_id": "PLACEHOLDER",
    "video_duration_seconds": 305
  },
  {
    "id": "chm210-12-reaction-mechanisms",
    "title": "Reaction Mechanisms & Elementary Steps",
    "description": "How an overall reaction is built from elementary steps with their own molecularity.",
    "type": "conceptual",
    "course_id": "chm210-gombe",
    "module": "Mechanisms",
    "week": 6,
    "mastery_criteria": "Student can distinguish elementary steps from the overall reaction and state their molecularity.",
    "video_id": "PLACEHOLDER",
    "video_duration_seconds": 275
  },
  {
    "id": "chm210-13-rate-determining-step",
    "title": "The Rate-Determining Step",
    "description": "How the slowest elementary step controls the observed rate law of a mechanism.",
    "type": "conceptual",
    "course_id": "chm210-gombe",
    "module": "Mechanisms",
    "week": 7,
    "mastery_criteria": "Student can derive a rate law from a proposed mechanism using the rate-determining step.",
    "video_id": "PLACEHOLDER",
    "video_duration_seconds": 295
  },
  {
    "id": "chm210-14-catalysis",
    "title": "How Catalysts Work",
    "description": "How catalysts provide an alternative pathway with lower activation energy without being consumed.",
    "type": "conceptual",
    "course_id": "chm210-gombe",
    "module": "Mechanisms",
    "week": 7,
    "mastery_criteria": "Student can explain how a catalyst changes the energy profile and why it is not consumed.",
    "video_id": "PLACEHOLDER",
    "video_duration_seconds": 250
  },
  {
    "id": "chm210-15-mechanism-validation",
    "title": "Testing a Mechanism Against Data",
    "description": "Checking whether a proposed mechanism is consistent with the experimentally observed rate law.",
    "type": "meta",
    "course_id": "chm210-gombe",
    "module": "Mechanisms",
    "week": 8,
    "mastery_criteria": "Student can judge whether a mechanism is plausible by comparing its predicted rate law to experiment.",
    "video_id": "PLACEHOLDER",
    "video_duration_seconds": 285
  }
]
