[
  {
    "id": "mth204-01-linear-equations",
    "title": "Linear Equations in Several Variables",
    "description": "What makes an equation linear and what a solution to a system of linear equations means geometrically.",
    "type": "conceptual",
    "course_id": "mth204-gombe",
    "module": "Systems of Equations",
    "week": 1,
    "mastery_criteria": "Student can recognise a linear equation and describe the solution set of a small system geometrically.",
    "video_id": "PLACEHOLDER",
    "video_duration_seconds": 250
  },
  {
    "id": "mth204-02-augmented-matrix",
    "title": "Representing Systems as Augmented Matrices",
    "description": "How to encode a linear system compactly as an augmented matrix.",
    "type": "representational",
    "course_id": "mth204-gombe",
    "module": "Systems of Equations",
    "week": 1,
    "mastery_criteria": "Student can convert between a system of equations and its augmented matrix form.",
    "video_id": "PLACEHOLDER",
    "video_duration_seconds": 220
  },
  {
    "id": "mth204-03-gaussian-elimination",
    "title": "Gaussian Elimination",
    "description": "Using row operations to reduce a matrix to row-echelon form and solve the system.",
    "type": "procedural",
    "course_id": "mth204-gombe",
    "module": "Systems of Equations",
    "week": 2,
    "mastery_criteria": "Student can perform Gaussian elimination to reach row-echelon form and back-substitute.",
    "video_id": "PLACEHOLDER",
    "video_duration_seconds": 320
  },
  {
    "id": "mth204-04-reduced-row-echelon",
    "title": "Reduced Row-Echelon Form",
    "description": "Extending elimination to reduced row-echelon form and reading solutions directly.",
    "type": "procedural",
    "course_id": "mth204-gombe",
    "module": "Systems of Equations",
    "week": 2,
    "mastery_criteria": "Student can produce reduced row-echelon form and classify a system as unique, infinite or no solution.",
    "video_id": "PLACEHOLDER",
    "video_duration_seconds": 300
  },
  {
    "id": "mth204-05-matrix-operations",
    "title": "Matrix Addition & Scalar Multiplication",
    "description": "The basic algebra of matrices: adding, scaling, and when these operations are defined.",
    "type": "procedural",
    "course_id": "mth204-gombe",
    "module": "Matrix Algebra",
    "week": 3,
    "mastery_criteria": "Student can add and scale matrices and state the dimension rules for these operations.",
    "video_id": "PLACEHOLDER",
    "video_duration_seconds": 210
  },
  {
    "id": "mth204-06-matrix-multiplication",
    "title": "Matrix Multiplication",
    "description": "How to multiply matrices and why the operation is defined the way it is.",
    "type": "procedural",
    "course_id": "mth204-gombe",
    "module": "Matrix Algebra",
    "week": 3,
    "mastery_criteria": "Student can multiply conformable matrices and explain why multiplication is not commutative.",
    "video_id": "PLACEHOLDER",
    "video_duration_seconds": 290
  },
  {
    "id": "mth204-07-identity-and-inverse",
    "title": "Identity & Inverse Matrices",
    "description": "The identity matrix and what it means for a square matrix to have an inverse.",
    "type": "conceptual",
    "course_id": "mth204-gombe",
    "module": "Matrix Algebra",
    "week": 4,
    "mastery_criteria": "Student can define the identity and inverse and verify that a given matrix is an inverse.",
    "video_id": "PLACEHOLDER",
    "video_duration_seconds": 255
  },
  {
    "id": "mth204-08-computing-inverse",
    "title": "Computing the Inverse by Elimination",
    "description": "Finding a matrix inverse using Gauss-Jordan elimination on an augmented identity.",
    "type": "procedural",
    "course_id": "mth204-gombe",
    "module": "Matrix Algebra",
    "week": 4,
    "mastery_criteria": "Student can compute the inverse of a small matrix via row reduction and know when it fails to exist.",
    "video_id": "PLACEHOLDER",
    "video_duration_seconds": 300
  },
  {
    "id": "mth204-09-determinant-2x2-3x3",
    "title": "Determinants of Small Matrices",
    "description": "Computing 2x2 and 3x3 determinants and their geometric meaning as area and volume scaling.",
    "type": "procedural",
    "course_id": "mth204-gombe",
    "module": "Determinants",
    "week": 5,
    "mastery_criteria": "Student can compute 2x2 and 3x3 determinants and interpret the sign and magnitude.",
    "video_id": "PLACEHOLDER",
    "video_duration_seconds": 265
  },
  {
    "id": "mth204-10-determinant-properties",
    "title": "Properties of Determinants",
    "description": "How row operations affect the determinant and the link between a zero determinant and invertibility.",
    "type": "conceptual",
    "course_id": "mth204-gombe",
    "module": "Determinants",
    "week": 5,
    "mastery_criteria": "Student can predict how a determinant changes under row operations and connect det = 0 to singularity.",
    "video_id": "PLACEHOLDER",
    "video_duration_seconds": 260
  },
  {
    "id": "mth204-11-vector-spaces",
    "title": "Vector Spaces & Subspaces",
    "description": "The axioms of a vector space and how subspaces sit inside them.",
    "type": "conceptual",
    "course_id": "mth204-gombe",
    "module": "Vector Spaces",
    "week": 6,
    "mastery_criteria": "Student can verify whether a set with given operations is a vector space or subspace.",
    "video_id": "PLACEHOLDER",
    "video_duration_seconds": 300
  },
  {
    "id": "mth204-12-linear-independence",
    "title": "Linear Independence",
    "description": "When a set of vectors is linearly independent and how to test it.",
    "type": "conceptual",
    "course_id": "mth204-gombe",
    "module": "Vector Spaces",
    "week": 6,
    "mastery_criteria": "Student can determine whether vectors are linearly independent using elimination.",
    "video_id": "PLACEHOLDER",
    "video_duration_seconds": 285
  },
  {
    "id": "mth204-13-basis-and-dimension",
    "title": "Basis & Dimension",
    "description": "How a basis spans a space with independent vectors and defines its dimension.",
    "type": "conceptual",
    "course_id": "mth204-gombe",
    "module": "Vector Spaces",
    "week": 7,
    "mastery_criteria": "Student can find a basis for a subspace and state its dimension.",
    "video_id": "PLACEHOLDER",
    "video_duration_seconds": 295
  },
  {
    "id": "mth204-14-eigenvalues",
    "title": "Eigenvalues & the Characteristic Equation",
    "description": "What an eigenvalue is and how to find it from the characteristic polynomial.",
    "type": "conceptual",
    "course_id": "mth204-gombe",
    "module": "Eigentheory",
    "week": 8,
    "mastery_criteria": "Student can set up and solve the characteristic equation to find eigenvalues of a small matrix.",
    "video_id": "PLACEHOLDER",
    "video_duration_seconds": 310
  },
  {
    "id": "mth204-15-eigenvectors",
    "title": "Eigenvectors & Eigenspaces",
    "description": "Finding the eigenvectors associated with each eigenvalue and the eigenspace they span.",
    "type": "procedural",
    "course_id": "mth204-gombe",
    "module": "Eigentheory",
    "week": 8,
    "mastery_criteria": "Student can compute eigenvectors for a given eigenvalue by solving the null space of A minus lambda I.",
    "video_id": "PLACEHOLDER",
    "video_duration_seconds": 300
  },
  {
    "id": "mth204-16-diagonalization",
    "title": "Diagonalization",
    "description": "When a matrix can be diagonalized and why diagonal form makes powers and dynamics easy.",
    "type": "meta",
    "course_id": "mth204-gombe",
    "module": "Eigentheory",
    "week": 9,
    "mastery_criteria": "Student can decide whether a matrix is diagonalizable and construct the diagonalizing change of basis.",
    "video_id": "PLACEHOLDER",
    "video_duration_seconds": 330
  }
]
