[
  {
    "id": "bio301-01-energy-and-atp",
    "title": "Energy, Work & the Role of ATP",
    "description": "Why cells need a rechargeable energy currency, and how ATP stores and releases energy through its phosphate bonds.",
    "type": "conceptual",
    "course_id": "bio301-gombe",
    "module": "Foundations",
    "week": 1,
    "mastery_criteria": "Student can explain why ATP is called the energy currency of the cell and describe what happens when ATP is hydrolysed to ADP.",
    "video_id": "PLACEHOLDER",
    "video_duration_seconds": 265
  },
  {
    "id": "bio301-02-redox-reactions",
    "title": "Redox Reactions & Electron Carriers",
    "description": "Oxidation and reduction as electron transfer, and how NAD+ and FAD shuttle electrons during respiration.",
    "type": "conceptual",
    "course_id": "bio301-gombe",
    "module": "Foundations",
    "week": 1,
    "mastery_criteria": "Student can identify which species is oxidised and which is reduced in a reaction and explain the role of NAD+/NADH.",
    "video_id": "PLACEHOLDER",
    "video_duration_seconds": 298
  },
  {
    "id": "bio301-03-metabolic-pathways",
    "title": "Reading a Metabolic Pathway Diagram",
    "description": "How to interpret the arrows, enzymes and intermediates in a metabolic pathway map.",
    "type": "representational",
    "course_id": "bio301-gombe",
    "module": "Foundations",
    "week": 2,
    "mastery_criteria": "Student can trace substrates to products through a pathway diagram and name the enzyme catalysing a given step.",
    "video_id": "PLACEHOLDER",
    "video_duration_seconds": 240
  },
  {
    "id": "bio301-04-glucose-structure",
    "title": "Glucose as a Fuel Molecule",
    "description": "The structure of glucose and why its bonds hold the chemical energy respiration extracts.",
    "type": "conceptual",
    "course_id": "bio301-gombe",
    "module": "Glycolysis",
    "week": 2,
    "mastery_criteria": "Student can explain where the energy in glucose is stored and why it must be released stepwise.",
    "video_id": "PLACEHOLDER",
    "video_duration_seconds": 210
  },
  {
    "id": "bio301-05-glycolysis-overview",
    "title": "Glycolysis: The Ten-Step Overview",
    "description": "The overall input and output of glycolysis and its split into energy-investment and energy-payoff phases.",
    "type": "conceptual",
    "course_id": "bio301-gombe",
    "module": "Glycolysis",
    "week": 3,
    "mastery_criteria": "Student can state the net ATP, NADH and pyruvate yield of glycolysis from one glucose.",
    "video_id": "PLACEHOLDER",
    "video_duration_seconds": 320
  },
  {
    "id": "bio301-06-glycolysis-regulation",
    "title": "Regulating Glycolysis",
    "description": "How phosphofructokinase and feedback inhibition tune the rate of glycolysis to the cell's energy needs.",
    "type": "conceptual",
    "course_id": "bio301-gombe",
    "module": "Glycolysis",
    "week": 3,
    "mastery_criteria": "Student can explain how ATP and AMP levels regulate phosphofructokinase activity.",
    "video_id": "PLACEHOLDER",
    "video_duration_seconds": 275
  },
  {
    "id": "bio301-07-pyruvate-oxidation",
    "title": "Pyruvate Oxidation & Acetyl-CoA",
    "description": "How pyruvate is converted to acetyl-CoA, linking glycolysis to the citric acid cycle.",
    "type": "procedural",
    "course_id": "bio301-gombe",
    "module": "Citric Acid Cycle",
    "week": 4,
    "mastery_criteria": "Student can describe the decarboxylation of pyruvate and the formation of acetyl-CoA and NADH.",
    "video_id": "PLACEHOLDER",
    "video_duration_seconds": 250
  },
  {
    "id": "bio301-08-citric-acid-cycle",
    "title": "The Citric Acid Cycle",
    "description": "The eight-step cycle that fully oxidises acetyl-CoA, producing NADH, FADH2 and GTP.",
    "type": "conceptual",
    "course_id": "bio301-gombe",
    "module": "Citric Acid Cycle",
    "week": 4,
    "mastery_criteria": "Student can state the per-cycle yield of NADH, FADH2 and ATP/GTP and where CO2 is released.",
    "video_id": "PLACEHOLDER",
    "video_duration_seconds": 340
  },
  {
    "id": "bio301-09-cycle-regulation",
    "title": "Regulation of the Citric Acid Cycle",
    "description": "How NADH and ATP concentrations feed back to control the pace of the cycle.",
    "type": "conceptual",
    "course_id": "bio301-gombe",
    "module": "Citric Acid Cycle",
    "week": 5,
    "mastery_criteria": "Student can name the regulated enzymes of the cycle and explain how energy charge controls them.",
    "video_id": "PLACEHOLDER",
    "video_duration_seconds": 230
  },
  {
    "id": "bio301-10-mitochondria-structure",
    "title": "Mitochondrial Membrane Architecture",
    "description": "The inner and outer membranes, cristae and matrix, and why compartmentation matters for respiration.",
    "type": "representational",
    "course_id": "bio301-gombe",
    "module": "Oxidative Phosphorylation",
    "week": 5,
    "mastery_criteria": "Student can label the mitochondrial compartments and explain the role of the inner membrane.",
    "video_id": "PLACEHOLDER",
    "video_duration_seconds": 245
  },
  {
    "id": "bio301-11-electron-transport-chain",
    "title": "The Electron Transport Chain",
    "description": "How complexes I-IV pass electrons down an energy gradient and pump protons across the inner membrane.",
    "type": "conceptual",
    "course_id": "bio301-gombe",
    "module": "Oxidative Phosphorylation",
    "week": 6,
    "mastery_criteria": "Student can order the electron carriers by redox potential and explain proton pumping.",
    "video_id": "PLACEHOLDER",
    "video_duration_seconds": 355
  },
  {
    "id": "bio301-12-proton-gradient",
    "title": "The Proton Gradient & Chemiosmosis",
    "description": "How the proton-motive force stores energy across the inner mitochondrial membrane.",
    "type": "conceptual",
    "course_id": "bio301-gombe",
    "module": "Oxidative Phosphorylation",
    "week": 6,
    "mastery_criteria": "Student can define the proton-motive force and explain how it couples the ETC to ATP synthesis.",
    "video_id": "PLACEHOLDER",
    "video_duration_seconds": 260
  },
  {
    "id": "bio301-13-atp-synthase",
    "title": "ATP Synthase Mechanism",
    "description": "Plain-language explanation of how ATP synthase converts a proton gradient into chemical energy.",
    "type": "conceptual",
    "course_id": "bio301-gombe",
    "module": "Oxidative Phosphorylation",
    "week": 7,
    "mastery_criteria": "Student can explain the three stages of chemiosmosis and name the enzyme involved.",
    "video_id": "PLACEHOLDER",
    "video_duration_seconds": 288
  },
  {
    "id": "bio301-14-atp-yield-accounting",
    "title": "Accounting for the Total ATP Yield",
    "description": "Adding up ATP from glycolysis, the cycle and oxidative phosphorylation per glucose.",
    "type": "procedural",
    "course_id": "bio301-gombe",
    "module": "Integration",
    "week": 7,
    "mastery_criteria": "Student can calculate the approximate total ATP yield from one glucose and justify each contribution.",
    "video_id": "PLACEHOLDER",
    "video_duration_seconds": 300
  },
  {
    "id": "bio301-15-anaerobic-fermentation",
    "title": "Anaerobic Respiration & Fermentation",
    "description": "What happens when oxygen is absent, and how fermentation regenerates NAD+ to keep glycolysis running.",
    "type": "conceptual",
    "course_id": "bio301-gombe",
    "module": "Integration",
    "week": 8,
    "mastery_criteria": "Student can explain why fermentation is needed anaerobically and compare its yield to aerobic respiration.",
    "video_id": "PLACEHOLDER",
    "video_duration_seconds": 270
  },
  {
    "id": "bio301-16-respiration-metabolism-integration",
    "title": "Integrating Respiration with Whole-Cell Metabolism",
    "description": "How respiration connects to fat and protein catabolism and adjusts to the cell's changing demands.",
    "type": "meta",
    "course_id": "bio301-gombe",
    "module": "Integration",
    "week": 8,
    "mastery_criteria": "Student can describe how fats and amino acids feed into respiration and how the whole system is regulated.",
    "video_id": "PLACEHOLDER",
    "video_duration_seconds": 315
  }
]
